820,MD,1,食事の重要性，心身の成長や健康の保持増進の上で望ましい栄養や食事のとり方，食品の品質及び安全性等について自ら判断できる能力，望ましい食習慣の形成，地域の産物，食文化の理解，基礎的・基本的な調理の知識及び技能などを総合的に育むことが大切である。
821,MD,1,「衣生活」の内容は，(4)「衣服の選択と手入れ」，(5)「生活を豊かにするための布を用いた製作」の2項目で構成されている。
822,MD,1,衣服の適切な選択や着用，衣服の計画的な活用，日常着の手入れ，製作に関する知識及び技能を身に付け，これからの生活を展望して，衣生活の課題を解決する力を養い，衣生活を工夫し創造しようとする実践的な態度を育成する。
823,MD,1,資源や環境に配慮する視点から，衣服等の再利用の方法についても触れることとしている。
824,MD,1,衣服の計画的な活用においては，衣服の選択や購入，手入れを取り上げ，購入から廃棄までを見通し，資源や環境に配慮することの大切さに気付かせるようにする。
825,MD,1,衣服の機能については，社会生活を営む上での機能を中心に扱い，日本の伝統的な衣服である和服について触れることとしている。
826,MD,1,衣服の選択，材料や状態に応じた日常着の手入れの仕方を考え，工夫すること。
827,MD,1,日本の伝統的な衣服である和服について触れること。
828,MD,1,和服の基本的な着装を扱うこともできること。さらに，既製服の表示と選択に当たっての留意事項を扱うこと。
829,MD,1,日常着の手入れは主として洗濯と補修を扱うこと。
830,MD,1,衣服の選択と手入れについて，課題をもって，衣服と社会生活との関わりについて理解し，衣服の選択，着用及び手入れに関する基礎的・基本的な知識及び技能を身に付け，衣服の選択，日常着の手入れの仕方を工夫することができるようにすることをねらいとしている。
831,MD,1,衣服と社会生活との関わりが分かり，目的に応じた着用，個性を生かす着用及び衣服の適切な選択について理解すること。
832,MD,1,衣服の社会生活上の機能が分かり，時・場所・場合に応じた衣服の着用や個性を生かす着用，衣服の適切な選択について理解できるようにする。
833,MD,1,所属や職業を表したり，行事などによって衣服や着方にきまりがあったりするなど，社会生活を営む上での機能を中心に理解できるようにする。
834,MD,1,和服は日本の伝統的な衣服であり，冠婚葬祭や儀式等で着用することや，地域の祭りなどで浴衣を着用することなどについて触れるようにする。
835,MD,1,和服と洋服の構成や着方の違いに気付くようにするとともに，和服の基本的な着装を扱うことも考えられる。
836,MD,1,学校生活や行事，訪問などの目的に応じた，それぞれの場にふさわしい着方があることを理解できるようにする。
837,MD,1,個性を生かす着用については，衣服の種類や組合せ，襟の形やゆとり，色などによって人に与える印象が異なることを理解できるようにする。
838,MD,1,衣服の適切な選択については，既製服を中心に取り扱い，組成表示，取扱い表示，サイズ表示等の意味を理解できるようにする。
839,MD,1,衣服の購入に当たっては，縫い方やボタン付け等の縫製の良否，手入れの仕方，手持ちの衣服との組合せ，価格などにも留意し，目的に応じて衣服を選択する必要があることを理解できるようにする。
840,MD,1,また，既製服のサイズは身体部位の寸法で示されることと計測の仕方を理解できるようにする。
841,MD,1,なお，衣服の入手については，購入するだけではなく，環境に配慮する視点から，他の人から譲り受けたり，リフォームしたりする方法があることにも触れるようにする。
842,MD,1,例えば，目的に応じた着用については，各種の制服や流行について話し合ったり，具体的な生活場面を想定して発表し合ったりする活動などが考えられる。
843,MD,1,衣服の計画的な活用の必要性，衣服の材料や状態に応じた日常着の手入れについて理解し，適切にできること。
844,MD,1,衣服を快適に着用するために，衣服を計画的に活用することの必要性が分かり，衣服の材料や汚れ方に応じた日常着の洗濯と衣服の状態に応じた補修等の手入れについて理解し，適切にできるようにする。
845,MD,1,衣服の計画的な活用の必要性については，衣服の過不足や処分を考えることを通して，着用しなくなった衣服を再利用したりリサイクルしたりするなど，衣服を計画的に活用する必要があることを理解できるようにする。
846,MD,1,健康・快適だけではなく，資源や環境への配慮の視点から，廃棄までを見通して衣服を購入することや，長持ちさせるための手入れが大切であることにも気付くようにする。
847,MD,1,綿，毛，ポリエステルなどを取り上げ，丈夫さ，防しわ性，アイロンかけの効果，洗濯による収縮性など，手入れに関わる基本的な性質とその違いに応じた手入れの仕方を理解し，日常着の洗濯などが適切にできるようにする。
848,MD,1,洗濯については，洗剤の働きと衣服の材料に応じた洗剤の種類などが分かり，洗剤を適切に選択して使用できるようにする。
849,MD,1,衣服の材料や汚れ方に応じた洗濯の仕方について理解できるようにする。
850,MD,1,洗い方については，汚れ落ちには，水性や油性などの汚れの性質，洗剤の働き，電気洗濯機の水流の強弱などが関わっていることや，部分洗いの効果にも気付くようにする。
851,MD,1,綿と毛，また，同じ綿でも織物と編物により，布の収縮や型くずれに配慮した洗い方や干し方などがあることにも触れるようにする。
852,MD,1,電気洗濯機を用いた洗濯の方法と特徴を理解し，洗濯機を適切に使用できるようにする。
853,MD,1,衣服によっては専門業者に依頼する必要があることや，手入れをした衣服を適切に保管する必要があることにも気付くようにする。
854,MD,1,衣服の状態に応じた日常着の手入れについては，衣服を大切にし，長持ちさせるために，例えば，まつり縫いによる裾上げ，ミシン縫いによるほころび直し，スナップ付けなどの補修を取り上げ，その目的と布地に適した方法について理解し，適切にできるようにする。
855,MD,1,日常の手入れとして，ブラシかけなどが有効であることを理解し，適切にできるようにする。
856,MD,1,指導に当たっては，実験，実習や調査を取り入れたり，デジタル教材などを活用したりすることを通して，具体的に理解できるようにするとともに，衣服の活用や手入れについて関心を高め，生活における実践につなげることができるよう配慮する。
857,MD,1,衣服の計画的な活用の必要性については，どのような資源が衣服の原料としてリサイクルされているのかを調べたり，回収された資源が新しい衣服に生まれ変わるまでの一連の流れを調べたりする活動などが考えられる。
858,MD,1,衣服の材料に応じた日常着の手入れについては，電気洗濯機を用いた実習を通して，洗濯機の水流の強弱による汚れの落ち方や布の収縮について調べたり，事前に手洗いをして洗濯するなど，部分洗いの効果について調べたりする活動などが考えられる。
859,MD,1,洗剤の働きなどについてデジタル教材を活用することなどが考えられる。
860,MD,1,身近な環境に配慮した水や洗剤の適切な使い方を調べるなど，持続可能な社会の構築についての理解が深まるよう配慮する。
861,MD,1,衣服の選択，材料や状態に応じた日常着の手入れの仕方を考え，工夫すること。
862,MD,1,衣服の選択や手入れについての課題を解決するために，アで身に付けた基礎的・基本的な知識及び技能を活用し，健康・快適などの視点から，衣服の選択及び手入れの仕方を考え，工夫することができるようにする。
863,MD,1,主に既製服の選択，購入に関する問題を見いだし，課題を設定するようにする。
864,MD,1,解決方法については，コンピュータなどの情報手段を活用して調べたり，デジタル教材を参考にしたりする活動や各自の生活経験について意見交流する活動などを通して，適切な衣服の選択について検討できるようにする。
865,MD,1,主に日常着の洗濯に関する問題を見いだし，課題を設定するようにする。
866,MD,1,解決方法については，洗剤や洗濯機について，家庭で調べたことを発表する活動や，衣服の材料や洗剤の特性について実験したりする活動を通して，衣服の材料に適した洗剤を選択し，材料や汚れ方に応じた洗濯の仕方について検討できるようにする。
867,MD,1,指導に当たっては，解決方法を考え，計画を立てたり，実践したことを評価・改善したりする際，他者との意見交換などを通して，多角的に検討できるよう配慮する。
868,MD,1,日常着の手入れについては，自分の衣服の材料に適した洗剤を選んだり，材料や汚れ方に応じて洗濯の仕方を考えたり，家庭で実践したりしたことについて，発表したりする活動などが考えられる。
869,MD,1,衣服等の再利用の方法についても触れること。
870,MD,1,生活を豊かにするための布を用いた製作について，課題をもって，製作する物に適した材料や縫い方，用具の安全な取扱いに関する基礎的・基本的な知識及び技能を身に付け，資源や環境に配慮して製作計画を考え，製作を工夫することができるようにすることをねらいとしている。
871,MD,1,生活を豊かにするための布を用いた製作とは，身の回りの生活を快適にしたり，便利にしたり，さらに資源や環境に配慮したりするなど，自分や家族，地域の人々の生活を豊かにする物を製作することである。
872,MD,1,布を用いた製作は，生活に役立つばかりではなく，家族や地域の人々との関わりを深めたり，生活文化への関心を高めたり，持続可能な社会の構築について考えたりすることにつながり，生活を豊かにするための営みに係るものである。
873,MD,1,製作を通して，自分自身が豊かな気持ちになることに気付くことができるようにするとともに，衣服等の再利用など布を無駄なく使うことが，資源や環境への配慮につながることを理解し，製作を工夫することができるようにする。
874,MD,1,「A家族・家庭生活」の(2)「幼児の生活と家族」の学習との関連を図り，幼児の生活を豊かにするための物を製作したり，「C消費生活・環境」の(2)「消費者の権利と責任」の学習との関連を図り，環境に配慮した生活を工夫するための物を製作したりすることなどが考えられる。
875,MD,1,製作に必要な材料，用具，製作手順，時間等の見通しをもち，目的に応じた縫い方や製作方法，ミシンやアイロン等の用具の安全な取扱いについて理解し，製作が適切にできるようにする。
876,MD,1,製作する物に適した材料や縫い方については，布等の材料の特徴を理解し，製作する物に適した材料を選ぶとともに，目的に応じた縫い方や製作方法等について理解できるようにする。
877,MD,1,衣服等を別の用途に作り直したり，デザインを変えたりするなど，再利用の方法について触れるようにする。
878,MD,1,製作に使用するミシンについては，使用前の点検，使用後の手入れとしまい方，簡単な調整方法について理解し，適切にできるようにする。
879,MD,1,ミシンの操作については，姿勢や動作が作業の正確さや能率に関係すること，作業環境の整備が安全に影響することなどにも触れるようにする。
880,MD,1,アイロンの取扱いについては，(4)のアの(イ)「日常着の手入れ」との関連を図り，布に応じた使い方ができるようにするとともに，火傷等に留意し，使用中，使用後の安全指導の徹底を図るようにする。
881,MD,1,様々な種類の布や縫い方の見本を参考にして，製作の用途に適した布や縫い方について話し合う活動などが考えられる。
882,MD,1,衣服等の再利用の方法については，具体的に理解できるよう，地域の高齢者や専門家などの協力を得ることなども考えられる。
883,MD,1,解決方法については，コンピュータなどの情報手段を活用して，衣服等の再利用の方法など布を無駄なく使う方法について調べる活動を通して，資源や環境に配慮した製作について検討できるようにする。
884,MD,1,既習事項や自分の生活経験と関連付けて考え，適切な解決方法を選び，製作に向けて具体的に計画を立てることができるようにする。
885,MD,1,製作の目的を明確にもち，個性や工夫が生かせるよう配慮する。
886,MD,1,製作の評価・改善については，計画どおりにできたかどうかなどを振り返って評価し，実践発表会などを通して，改善方法について考えることができるようにする。
887,MD,1,指導に当たっては，解決方法を考え，計画を立てたり，製作について評価・改善したりする際，他者との意見交換などを通して，多角的に検討できるよう配慮する。
888,MD,1,製作を通して，成就感を味わうとともに，自分や家族，地域の人々の生活を豊かにすることの大切さを実感できるよう配慮する。
889,MD,1,製作品を活用することを通して，資源や環境を大切にしようとする態度の育成につなげるよう配慮する。
890,MD,1,布を用いた物の製作計画については，例えば，生活を豊かにするための目的に合っているかどうか，資源や環境に配慮して，衣服等の再利用や布を無駄なく使うなどの工夫があるかどうかについて検討し，計画を見直して改善する活動などが考えられる。
891,MD,1,布を用いた物の製作については，例えば，着用されなくなった衣服を他の衣服に作り直す，別の用途の物に作り替えるなどの再利用の仕方を考えたり，色や柄の異なる複数の布を組み合わせて布の無駄のない使い方を考えたりして，製作を工夫する活動などが考えられる。
892,MD,1,「住生活」の内容は，(6)「住居の機能と安全な住まい方」の1項目で構成されている。
893,MD,1,家族の生活と住空間との関わり，住居の基本的な機能，家族の安全を考えた住空間の整え方に関する知識及び技能を身に付け，これからの生活を展望して，住生活の課題を解決する力を養い，住生活を工夫し創造しようとする実践的な態度を育成する。
894,MD,1,今回の改訂では，小学校と中学校の内容の系統性を図り，幼児や高齢者の家庭内の事故を防ぎ，自然災害に備えるための住空間の整え方を重点的に扱い，安全な住まい方の学習の充実を図ることとした。
895,MD,1,日本の生活文化への理解を深めるために，日本の伝統的な住様式等を扱うことなどが考えられる。
896,MD,1,家族の安全を考えた住空間の整え方について考え，工夫すること。
897,MD,1,簡単な図などによる住空間の構想を扱うこと。
898,MD,1,自然災害に備えた住空間の整え方についても扱うこと。
899,MD,1,住居の機能と安全な住まい方について，課題をもって，住居の基本的な機能について理解し，家庭内の事故を防ぎ，自然災害に備えるための住空間の整え方に関する基礎的・基本的な知識を身に付け，家族の安全を考えた住空間の整え方を工夫することができるようにすることをねらいとしている。
900,MD,1,「A家族・家庭生活」の(2)「幼児の生活と家族」の幼児の発達や，(3)「家族・家庭や地域との関わり」の高齢者の身体の特徴との関連を図り，幼児や高齢者の家庭内の事故の防ぎ方について考えることができるようにする。
901,MD,1,家族の生活と住空間との関わりが分かり，住居の基本的な機能について理解すること。
902,MD,1,自分や家族の生活行為と住空間との関わりが分かり，住居の基本的な機能について理解できるようにする。
903,MD,1,家族の生活と住空間との関わりについては，家族がどのような生活を重視するのかによって，住空間の使い方が異なることを理解できるようにする。
904,MD,1,家族が共に暮らすためには，住生活に対する思いや願いを互いに尊重しながら調整して住空間を整える必要があることを理解できるようにする。
905,MD,1,畳，座卓，座布団などを用いた我が国の座式の住まい方が現代の住居に受け継がれていることが分かり，現代の住居には和式と洋式を組み合わせた住空間の使い方の工夫があることに気付くようにする。
906,MD,1,その際，小学校における季節の変化に合わせた住まい方の学習を踏まえて，我が国の伝統的な住宅や住まい方に見られる様々な知恵に気付き，生活文化を継承する大切さに気付くようにする。
907,MD,1,和式と洋式については，布団とベッドによる就寝の形態や，押入れとクローゼットによる収納の形態などにも触れるようにする。
908,MD,1,住居の基本的な機能については，家族の生活と住空間との関わりを考えることを通して，住居は家族の安定した居場所であることを理解できるようにする。
909,MD,1,主として心身の安らぎと健康を維持する働き，子どもが育つ基盤としての働きなどがあることを理解できるようにする。
910,MD,1,住居の基本的な機能を充たすために，住居には，共同生活の空間，個人生活の空間などが必要であることを理解できるようにする。
911,MD,1,指導に当たっては，住空間を想像できるような簡単な図や写真，動画などを用いて，家族の生活と住空間との関わりについて具体的に理解できるよう配慮する。
912,MD,1,住居の機能に気付かせるために，家族を想定し，間取りが分かるような簡単な図などを活用して，家族の生活行為がどのような住空間で行われているのか，家具などをどのように配置するのかを話し合う活動などが考えられる。
913,MD,1,家庭内の事故の防ぎ方など家族の安全を考えた住空間の整え方について理解すること。
914,MD,1,家族が安心して住まうためには，住空間を安全な状態に整える必要があることが分かり，家庭内の事故を防ぎ，自然災害に備えるための住空間の整え方について理解できるようにする。
915,MD,1,家庭内の事故の防ぎ方など家族の安全を考えた住空間の整え方については，幼児や高齢者など様々な年齢で構成される家族が，住居内で安全に生活できるよう住空間を整える必要があることについて理解できるようにする。
916,MD,1,"家庭内の事故については,幼児や高齢者に起きることが多い事故を取り上げ，事故の要因と対策としての安全管理の方法について理解できるようにする。"
917,MD,1,幼児については，幼児の目の高さで安全点検をしたり，落下防止のために手すりや柵の高さに配慮したりすることのほかに，さわったり口に入れたりしては困るものを手の届くところに置かないように配慮することなどに気付くようにする。
918,MD,1,高齢者については，身体の機能の低下に応じて段差をなくしたり，手すりを付けたりすることや，照明を明るくしたり，浴室やトイレなどでは温度差を解消したりする必要があることなどに気付くようにする。
919,MD,1,室内の空気環境が家族の健康に及ぼす影響として，一酸化炭素や化学物質などによる空気汚染についても取り上げ，室内の空気を清浄に保つことによって安全な室内環境を整えることができることに気付くようにする。
920,MD,1,自然災害については，地域の実態に応じて過去の災害の例を取り上げることなどが考えられる。
921,MD,1,地震の場合は，家具の転倒・落下・移動などの危険を予測し，危険な箇所を見付け出すことができるようにする。
922,MD,1,写真や動画，簡単な図などを用いて，家庭内の事故や自然災害への対策としての住空間の整え方について具体的に考えることができるよう配慮する。
923,MD,1,室内の写真などから危険な箇所を見付けて住空間の図に書き込み，それを基に必要な備えとして住空間の整え方を検討する活動などが考えられる。
924,MD,1,家庭内の事故については，幼児や高齢者などの疑似体験を通して，事故が起きる状況を想定し，具体的な対策について理解を深める活動なども考えられる。
925,MD,1,家族の安全を考えた住空間の整え方について考え，工夫すること。
926,MD,1,解決方法については，コンピュータなどの情報手段を活用して家庭内の事故を防ぐ方法や自然災害に備える方法について調べたり，幼児や高齢者がいる家族にインタビューしたりするなど，より安全な住空間の整え方について様々な視点から情報を収集して検討できるようにする。
927,MD,1,家庭分野及び他教科等の既習事項や，自分の生活経験と関連付けて考え，適切な解決方法を選び，具体的に住空間の安全計画を立てることができるようにする。
928,MD,1,安全計画の評価・改善については，課題の解決が十分に図られているかなどを振り返って評価し，計画の改善について考えることができるようにする。
929,MD,1,指導に当たっては，解決方法を考えたり，計画を立てて評価・改善したりする際，他者との意見交換などを通して，多角的に検討できるよう配慮する。
930,MD,1,家庭内の事故の防ぎ方に関する知識を活用し，家族の年齢構成などに合わせて安全対策を実践したり，家族が利用する地域内の施設の安全点検をしたりする活動などが考えられる。
931,MD,1,自然災害への備えについては，各家庭における危険箇所を確認したり，災害時の行動マニュアルを作成したりする活動などが考えられる。
932,MD,1,家庭分野の内容の「A家族・家庭生活」の(4)，「B衣食住の生活」の(7)及び「C消費生活・環境」の(3)については，これら三項目のうち，一以上を選択し履修させること。
933,MD,1,B(3)「日常食の調理と地域の食文化」とC(2)「消費者の権利と責任」との関連を図り，環境に配慮して調理することを課題として設定し，計画を立てて実践する活動などが考えられる。
934,MD,1,B(5)「生活を豊かにするための布を用いた製作」とA(2)「幼児の生活と家族」との関連を図り，幼児の生活を豊かにすることを課題として設定し，衣服を再利用した幼児の生活に役立つ物などの製作について計画を立てて実践する活動などが考えられる。
