471,JH,1,家庭科の特質に応じた「主体的な学び」とは、題材を通して見通しをもち、日常生活の課題の発見や解決に取り組んだり、基礎的・基本的な知識及び技能の習得に粘り強く取り組んだり、実践を振り返って新たな課題を見付け、主体的に取り組んだりする態度を育む学びである。
472,JH,1,学習した内容を実際の生活で生かす場面を設定し、自分の生活が家庭や地域と深く関わっていることを認識したり、自分の成長を自覚して実践する喜びに気付いたりすることができる活動などを充実させることが重要である。
473,JH,1,「対話的な学び」とは、協働したり、意見を共有して互いの考えを深めたり、家族や身近な人々などとの会話を通して考えを明確にしたりするなど、自らの考えを広げ深める学びである。
474,JH,1,「深い学び」とは、一連の学習過程の中で、「生活の営みに係る見方・考え方」を働かせながら、課題の解決に向けて自分なりに考え、表現するなどして資質・能力を身に付ける学びである。
475,JH,1,家庭科の目標に示した「生活の営みに係る見方・考え方」の視点から家庭生活を見直し、工夫することが大切であることに気付かせ、各内容の役割や働きについて学習する項目につなげるようにする。
476,JH,1,基礎的なものから応用的なものへ、簡単なものから複雑なものへと次第に発展するように、段階的に題材を配列する。また、反復が必要なものについては、題材に繰り返し位置付けるなど、指導計画を工夫する。
477,JH,1,B(2)「調理の基礎」及びB(5)「生活を豊かにするための布を用いた製作」以外の項目で構成された題材については、学年の発展性や系統性、季節、学校行事、地域等との関連を考え配列する。
478,JH,1,学習に集中したり、持続したりすることが難しい場合には、落ち着いて学習できるようにするため、道具や材料を必要最小限に抑えて準備したり、整理・整頓された学習環境で学習できるよう工夫したりすることが考えられる。
479,JH,1,活動への関心をもつことが難しい場合には、約束や注意点、手順等を視覚的に捉えられる掲示物やカードを明示したり、体感できる教材・教具を活用したりして関心を高めることが考えられる。
480,JH,1,周囲の状況に気が散りやすく、包丁、アイロン、ミシンなどの用具を安全に使用することが難しい場合には、手元に集中して安全に作業に取り組めるよう、個別の対応ができるような作業スペースや作業時間を確保することなどが考えられる。
481,JH,1,生活をよりよくしようと工夫する資質・能力を育てることは、生活習慣の大切さを知り、自分の生活を見直すことにつながるものである。
482,JH,1,家庭生活を大切にする心情を育むことは、家族を敬愛し、楽しい家庭をつくり、家族の役に立つことをしようとすることにつながるものである。
483,JH,1,「B衣食住の生活」において扱う生活文化に関する教材を、道徳科の「伝統と文化の尊重」における具体例として活用することなどが考えられる。
484,JH,1,道徳科で取り上げたことに関連する内容や教材を家庭科で扱う場合には、道徳科における指導の成果を生かすように工夫することも考えられる。
485,JH,1,施設・設備の安全管理に配慮し、学習環境を整備するとともに、熱源や用具、機械などの取扱いに注意して事故防止の指導を徹底すること。
486,JH,1,服装を整え、衛生に留意して用具の手入れや保管を適切に行うこと。
487,JH,1,調理に用いる食品については、生の魚や肉は扱わないなど、安全・衛生に留意すること。また、食物アレルギーについても配慮すること。
488,JH,1,実習室の安全管理については、各学校の実態に即し、機器類の使い方を含めて実習室の使い方に関する安全規則を定め、これらを掲示したり、指導計画の中に位置付けたりすることが大切である。
489,JH,1,事故や災害が発生した場合の応急措置や連絡等、緊急時の対応についても指導の徹底を図るようにする。
490,JH,1,設備の安全管理については、指導者が学習前後に機器類の安全確認を行うとともに、定期的な点検を実施するなど、常に最良の状況を保持できるように留意する。
491,JH,1,実習室の管理に当たっては、学習環境の整った実習室そのものが、学習意欲を高める効果があることに留意し、題材に関する資料や、児童の主体的な学習を支える教材等を実習室内に掲示するなど、児童の学習意欲を喚起するような工夫も必要である。
492,JH,1,安全指導については、実習に際して常に安全管理と事故の防止に努めることが大切であることを理解させ、それらを安全に扱うことができるようにし、基本的な操作を身に付けるように指導する。
493,JH,1,使用場所や用具の配置の仕方で作業の能率が高まり、事故の防止に役立つことにも気付かせるようにする。
494,JH,1,調理実習では、調理台の整理・整頓や用具の配置などを工夫させる。
495,JH,1,熱源の回りにふきんやノート類などの燃えやすい物を置かないことや、熱源の適切な点火・消火の確認や調理中の換気について指導する。
496,JH,1,加熱用調理器具の余熱にも注意させる。
497,JH,1,洗剤類の保管についても、誤用のないように十分留意する。
498,JH,1,製作実習では、針の本数の確認や折れた針の始末などを徹底させるとともに、アイロンについては、使用場所や置き方に留意し、火傷などを引き起こさないように指導する。
499,JH,1,機械については、ミシンなど重量のある物の配置、コードの取扱い方などについて十分に配慮させる。
500,JH,1,服装については、活動がしやすく安全性に配慮したものを準備して着用するように指導する。
501,JH,1,調理実習での服装は、清潔で、付いた汚れが分かりやすいエプロンなどを身に付けさせたり、袖口をまくったり腕カバーを付けたりするなどして作業に適したものを用いることや、髪の毛などが食品や調理器具等に触れないように三角巾を着けるなどの工夫をさせる。
502,JH,1,製作や調理実習の前には手指を十分に洗うなど衛生面にも留意するように指導する。
503,JH,1,加熱用調理器具は、回りの汚れを拭き取ること。
504,JH,1,調理用具は、使用したらなるべく早く丁寧に洗い、よく水気を取るようにすること。
505,JH,1,油の汚れは、紙や古い布などで拭き取ってから洗うようにすること。
506,JH,1,包丁は、安全に気を付けてよく洗い、水気を拭き取ること。
507,JH,1,まな板は、使用後、流し水をかけながら洗い、十分乾燥すること。
508,JH,1,ふきんは、洗剤を用いて洗い、直射日光に当てて乾燥すること。
509,JH,1,用具の保管については、安全や衛生に留意して指導する。
510,JH,1,調理実習については、茶碗などを重ねすぎないようにしたり、清潔な場所に収納したりするようにする。
511,JH,1,製作実習については、使用する針類、はさみ類、アイロン、ミシンなどの用具の安全な保管方法についても指導を徹底するとともに、アイロンは冷めてから収納場所に保管する。
512,JH,1,包丁やはさみは本数を確認し、保管箱に入れたりカバーを付けたりするなど、保管には十分留意し、常に安全管理に努めるように指導する。
513,JH,1,調理に用いる材料は安全や衛生を考えて選択するようにする。
514,JH,1,家庭から持参する場合は、実習の前に指導者が腐敗していないか匂いや色などを確かめたり、実習時間までの保管に十分留意したりする。
515,JH,1,生の魚や肉については調理の基礎を学習していない本学校の段階では、生の魚や肉の加熱不足が生じやすく、食品や調理器具等の衛生的な取扱いが難しいことから、用いないようにする。
516,JH,1,卵を用いる場合には、新鮮であることを確認し、加熱調理をするように指導する。
517,JH,1,食物アレルギーについては、保護者や関係機関等との情報共有を確実に行い、事故の防止に努めるようにする。
518,JH,1,調理実習で扱う材料にアレルギーの原因となる物質を含む食品が含まれていないかを確認する。
519,MD,1,社会，環境及び経済といった複数の側面から技術を評価し具体的な活用方法を考え出す力や，目的や条件に応じて設計したり，効率的な情報処理の手順を工夫したりする力の育成について課題があるとの指摘がある。
520,MD,1,社会の変化等に主体的に対応し，よりよい生活や持続可能な社会を構築していくため，発達を主体的に支え，革新を牽引することができるよう，評価，選択，管理・運用，改良，応用することが求められる。
521,MD,1,実践的・体験的な活動を通して，生活や社会の中から問題を見いだして課題を設定しそれを解決する力や，よりよい生活や持続可能な社会の構築に向けて，適切かつ誠実に工夫し創造しようとする態度等を育成することを基本的な考え方とする。
522,MD,1,材料，加工，生物育成，エネルギー変換，情報等の専門分野における重要な概念等を基にした教育内容とする。
523,MD,1,双方向性のあるコンテンツに関するプログラミングや，ネットワークやデータを活用して処理するプログラミングも題材として扱うことが考えられる。その際，情報セキュリティ等についても充実する。
524,MD,1,知的財産を創造・保護・活用していこうとする態度や使用者・生産者の安全に配慮して設計・製作したりするなどの倫理観の育成を重視する。
525,MD,1,「家族・家庭生活」，「衣食住の生活」，「消費生活・環境」に関する三つの内容で構成する。
526,MD,1,家庭の機能を理解し，家族や地域の人々と協働することや，幼児触れ合い体験，高齢者との交流等，人とよりよく関わる力を育成するための学習活動，食育を一層推進するための栄養と献立，調理や食文化などに関する学習活動を充実する。
527,MD,1,また，金銭の管理に関する内容や，消費生活や環境に配慮したライフスタイルの確立の基礎となる内容を充実するとともに，他の内容との関連を図り，実践的な学習活動を一層充実する。
528,MD,1,家族・家庭生活の多様化や消費生活の変化等に加えて，グローバル化や少子高齢社会の進展，持続可能な社会の構築等，今後の社会の急激な変化に主体的に対応すること。
529,MD,1,技術の発達を主体的に支え，技術革新を牽引することができる資質・能力の育成を目指して，目標及び内容について改善を図る。
530,MD,1,社会からの要求，安全性，環境負荷や経済性などに着目して技術を最適化すること。
531,MD,1,単に何かをつくるという活動ではなく，解決方策が最適なものとなるよう設計・計画し，製作・制作・育成を行い，その解決結果や解決過程を評価・改善するという活動の中で効果的に育成できると考えられる。
532,MD,1,情報セキュリティ等についても充実する。知的財産を創造，保護及び活用していこうとする態度や使用者・生産者の安全に配慮して設計・製作するなどの倫理観の育成を重視する。
533,MD,1,また，「生活の課題と実践」に係る「A家族・家庭生活」の(4)，「B衣食住の生活」の(7)及び「C消費生活・環境」の(3)については，これらの三項目のうち，一以上を選択して履修させ，他の内容と関連を図り扱うこととしている。
534,MD,1,少子高齢社会の進展に対応して，家族や地域の人々とよりよく関わる力を育成するために，「A家族・家庭生活」においては，幼児との触れ合い体験などを一層重視するとともに，高齢者など地域の人々と協働することに関する内容を新設している。
535,MD,1,グローバル化に対応して，日本の生活文化を継承することの大切さに気付くことができるよう，「B衣食住の生活」においては，和食，和服など，日本の伝統的な生活についても扱うこととしている。
536,MD,1,持続可能な社会の構築に対応して，自立した消費者を育成するために，「C消費生活・環境」においては，計画的な金銭管理，消費者被害への対応に関する内容を新設するとともに，他の内容と関連を図り，消費生活や環境に配慮したライフスタイルの確立の基礎となる内容の改善を図っている。
537,MD,1,資質・能力の育成に当たって，各分野の見方・考え方を働かせることが重要であることを示している。
538,MD,1,製作，制作，育成，調理等の実習や，観察・実験，見学，調査・研究などの実践的・体験的な活動を通して資質・能力を育成することが重要であることを示している。
539,MD,1,生活や社会の中から問題を見いだし，解決する力を育成することをねらいとしていることを示している。
540,MD,1,安心，安全で豊かな生活や，環境保全と利便性が両立した持続可能な社会の構築を目指し，将来にわたり生活を工夫したり創造したりしようとする実践的な態度を養う。
541,MD,1,さらに，自分や家族の生活の仕方や消費行動，適切な選択と管理・運用，新たな発想に基づく改良と応用などが，これからの社会を方向付けていくことを踏まえ，主体的に意思決定したり行動したりして社会に参画しようとする態度を育成することも重要である。
542,MD,1,生活の自立につながるように活動を組み立てることが重要である。
543,MD,1,家庭や地域社会との連携を重視し，学校における学習と家庭や社会における実践との結び付きに留意して適切な題材を設定し，資質・能力の育成とともに，心豊かな人間性を育むことや発達の段階に応じた社会性の獲得，他者と関わる力の育成等にも配慮することが大切である。
544,MD,1,従来の実践的・体験的な活動の内容を吟味し，仕事の楽しさや完成の喜びを味わわせるなど，充実感や成就感を実感させる。
545,MD,1,学習内容と将来の職業の選択や生き方との関わりの理解にも触れるなど，生徒の実態に応じた内容や活動を準備し，自ら問題を見いだして課題を設定し解決を図る問題解決的な学習を一層充実させる。
546,MD,1,適切に選択したり，管理・運用したりすることのできる力は，今後ますます高度化，システム化される技術に支えられた社会を生きる国民に求められる力の一つである。
547,MD,1,身体的な技能等を用いて製作・制作・育成を行うといった「ものづくり」が行われている。
548,MD,1,例えば，設計・計画の段階で，適切な課題の解決策が構想できないといった問題が生じた場合には，課題の設定の段階に戻り，新たな課題について検討することが必要となるなど，生徒の学習の状況に応じて，各段階間を往来するものである。
549,MD,1,社会からの要求としては，例えば，自然災害から身を守り，快適な生活環境を維持したいという人々の願いなどが考えられる。
550,MD,1,学習した事項が他の材料にも転用できるという視点で取り上げる材料を選択したり，履修する学年に応じて問題を見いだす範囲を限定したりするなど，授業時数と履修学年に応じて設定した目標とする資質・能力を踏まえて，各項目における具体的な指導内容を検討することにも配慮する。
551,MD,1,緻密なものづくりの技などが我が国の伝統や文化を支えてきたことに気付かせること。
552,MD,1,緻密なものづくりの技が，我が国の伝統や，木の文化・和の文化を支えてきたことに気付かせるようにする。
553,MD,1,原理・法則の指導に当たっては，理科における植物の体のつくりと働きや原子・分子等の物質の成り立ちなど，関係する指導内容を確認した上で，連携が図れるよう配慮する。
554,MD,1,製作に必要な図をかき，安全・適切な製作や検査・点検等ができること。
555,MD,1,問題を見いだして課題を設定し，材料の選択や成形の方法等を構想して設計を具体化するとともに，製作の過程や結果の評価，改善及び修正について考えること。
556,MD,1,製作に必要な図については，主として等角図及び第三角法による図法を扱うこと。
557,MD,1,製作に必要な図をかき，安全・適切な製作や検査・点検等ができるようにすることをねらいとしている。
558,MD,1,適切な図法を用いて，製作に必要な図をかくことができるようにするとともに，設定した課題を解決するために，工具や機器を使用して，安全・適切に材料取り，部品加工，組立て・接合，仕上げや，検査等ができるようにする。
559,MD,1,材料の種類や個数，工具や機器及び製作順序などをあらかじめ整理し，材料表や製作工程表を用いるなど，作業計画に基づいた能率的な作業ができるよう指導する。
560,MD,1,構想の表示方法については，現在，社会で主に利用されている図法の中で，CADによる表示といった発展性にも配慮し，等角図及び第三角法を取り上げることとする。
561,MD,1,知的財産を保護し，活用を図ることが新たな知的財産の創造につながることに気付かせるなど，知的財産を創造，保護及び活用しようとする態度の育成を目指すようにする。
562,MD,1,ここで使用する工具・機器や材料等については，安全や健康に十分に配慮して選択するとともに，工具・機器については，使用前の点検・調整や使用後の手入れが大切であることについて指導する。
563,MD,1,刃物などの工具や機器については，使い方を誤った場合には身体を傷つける恐れがあることから，安全な加工法の指導に加えて，不用意に持ち歩かないことなど，刃物の正しい取扱い方ができるよう十分に配慮する。
564,MD,1,加工機器を用いて作業させる場合には，材料の固定の方法，始動時及び運転中の注意事項などを確認させるとともに，ジグなどを使用して，安全な使い方ができるよう指導する。
565,MD,1,皮膚を露出しない作業着などを着用させたり，作業内容に応じて防護眼鏡，防塵マスク，手袋などの適切な保護具を着けさせたりする。また，必要に応じて機器に集塵機を取り付けるなど，衛生にも配慮する。
566,MD,1,家庭生活や学校生活における材料に関わる身近な不便さについて考えたり，既存の製品の改善の余地を考えたり，自然環境の保全や防災などに関わる社会的な問題について考えたりして，利便性，環境負荷，安全性などに関する問題を見いだす。
567,MD,1,なお，課題の解決策を構想する際には，自分の考えを整理し，実際の材料取りや部品加工等を行う前に設計の問題点を明らかにするとともに，よりよい発想を生み出せるよう，製作図等を適切に用いることについて指導する。
568,MD,1,課題の解決策を具体化する際には，3DCADや3Dプリンタを活用して試作させることも考えられる。
569,MD,1,社会からの要求としては，例えば，安定した食生活を送るために自然環境の影響を受けずに作物を栽培したいという人々の願いなどが考えられる。
570,MD,1,試験研究機関や民間企業，農業科や水産科を設置する高等学校等との連携についても配慮する。
571,MD,1,ア　(1)については，作物の栽培，動物の飼育及び水産生物の栽培のいずれも扱うこと。
572,MD,1,作物の栽培，動物の飼育及び水産生物の栽培のいずれも扱い，共通する基礎的な技術の仕組みを理解させるよう配慮する。
573,MD,1,学習活動としては，例えば，野生生物と育成生物の品種，生態，体の姿・形を比較したり，有機質肥料と化成肥料の働きや効果を比較したりすることや，季節を問わず販売される野菜や肉，魚などの生産過程で用いられている育成環境の調節方法を調べたりすることが考えられる。
574,MD,1,動物の飼育では，飼育する動物の性質や習性，食性，生理や発育の状況などについて考慮する必要があることや，目的に応じた最適な飼料の選択や給餌，給水，糞尿の処理等の管理作業，気温や採光，換気等の育成環境を調節する技術があることを理解させる。
575,MD,1,水産生物の栽培では，栽培する魚介類及び藻類の性質や習性，食性，生理や発育の状況などについて考慮する必要があることや，種苗の採苗や育成，最適な飼料の選択や給餌，放流等の管理作業，光や水温，水質等の育成環境を調節する技術があることを理解させる。
576,MD,1,その上で，食料の安定供給，安全性，品質・収量等の確保といった目的に合わせて，育成環境の調節方法を変えるなどの，生産者や開発者が計画等に込めた意図を読み取らせることが考えられる。
577,MD,1,安全・適切な栽培又は飼育，検査等ができること。
578,MD,1,イ問題を見いだして課題を設定し，育成環境の調節方法を構想して育成計画を立てるとともに，栽培又は飼育の過程や結果の評価，改善及び修正について考えること。
579,MD,1,地域固有の生態系に影響を及ぼすことのないよう留意するとともに，薬品を使用する場合には，使用上の基準及び注意事項を遵守させること。
580,MD,1,問題を見いだして課題を設定し，自分なりの解決策を構想させること。
581,MD,1,問題を見いだして課題を設定し解決する力を育成するとともに，安全・適切な栽培又は飼育，検査等ができるようにすることをねらいとしている。
582,MD,1,設定した課題を解決するために，資材や用具，設備を利用して，安全・適切に，生物の成長段階に応じた管理作業や病気や害虫等の防除，生物の生育状況や品質の検査等ができるようにする。
583,MD,1,生活や社会で利用されている生物育成の技術に込められた工夫や創造性及びそれに関わる知的財産のすばらしさと，それらがどのように普及してきたかを改めて振り返らせる。
584,MD,1,知的財産を保護し，活用を図ることが新たな知的財産の創造につながることに気付かせるなど，知的財産を創造，保護及び活用しようとする態度の育成を目指すようにする。
585,MD,1,固有の動植物など，地域に既存の生態系に影響を及ぼす可能性のある外来の生物等を取り扱う場合には，実習中のみならず，学習後の取り扱いについても十分配慮する。
586,MD,1,用具などについては，使用前の点検・調整や使用後の手入れが大切であることについて指導する。
587,MD,1,薬品などを使用する場合には，取扱説明書等を参照し，使用上の基準及び注意事項を遵守させる。
